fname,lname,dob,gender,address,country,email,phone,occupation,terms
Sushmita,Sen,1975-11-19,female,"6th Floor, Beach Queen, Yari Road, Versova, Andheri West, Mumbai",India,sushmita.sen@gmail.com,7878249657,Computer Engineer,on
Hrithik,Roshan,1974-01-10,male,"Mannat Apartments, 161, Balasaheb Sawant Rd, Gharkul Society, Four Bungalows, Andheri West, Mumbai, Maharashtra 400047",India,teamhrithikroshan@gmail.com,9849604886,Hotel Chef,off
Shah Rukh,Khan,1965-11-02,male,"Mannat, Land's End, Bandstand, Bandra (West), Mumbai, Maharashtra - 400050",India,srkfans@redchillies.com,5559960321,Bollywood Actor,on
Parineeti,Chopra,1988-10-22,female,"Seven Bunlows, Andheri, Mumbai, India",India,parineeti.chopra@gmail.com,9596055474,Theatre Artist,on
Salman,Khan,1965-12-27,male,"3, Galaxy Apartments, BJ Road Band Stand, Bandra West, Mumbai, Maharashtra  400050, India",India,skhan@khanacademy.org,9821014288,Research Scientist,on
